{
  "algorithm": "genetic_algorithm",
  "symbol": "PETR4.SA",
  "objective_value": 0.00079,
  "expected_return": 0.00110,
  "weights": {
    "ret_1d": 0.88,
    "ret_5d": 0.11,
    "ret_21d": 0.01
  },
  "elapsed_ms": 11.45,
  "metadata": {
    "risk_aversion": 0.35,
    "population_size": 32,
    "generations": 50,
    "seed": 42,
    "period": "2y",
    "interval": "1d",
    "samples": 480
  }
}
